{
  "meta": {
    "date": "2026-10-30",
    "schema_version": "v1.0",
    "source_briefing": "briefs/2026-10-30-aidc-hardware-morning-briefing.md",
    "note": "North American CSPs revised 2027 CapEx upward to $320B; Substation transformer lead times breached 120 weeks; Nittobo Low-Dk quartz cloth spot premium hit 31.8%; Liquid cooling CDU brazed plate heat exchanger second-sourcing qualification window opened."
  },
  "daily_report": {
    "date": "2026-10-30",
    "title": "AIDC Physical Infrastructure & Hardware Supply Chain Daily",
    "headline": "Transformer Lead Times Breach 120 Weeks! Nittobo Low-Dk Spot Premium Reaches 31.8% · Top 4 North American CSPs Revise 2027 CapEx to $320B · Vertiv Q3 Earnings Preview & Liquid CDU Backlog Tracking",
    "hotspot_count": 2,
    "warning_count": 6
  },
  "s1_capex_dynamics": [
    {
      "date": "2026-10-30",
      "title": "Top North American CSPs 2027 CapEx Guidance Revised to $320B, Over 45% Allocated to Power and Data Center Physical Shells",
      "fact": "Bloomberg Intelligence and Q3 pre-disclosures indicate median fiscal 2027 CapEx guidance across Microsoft, Meta, Alphabet, and Amazon has risen to $320B (+24.5% YoY). Direct substation builds, microgrids, and nuclear PPA investments surged from 22% two years ago to 46.8%. [Analyst Estimate]",
      "impact": "Long-term agreements for power distribution and backup generation are locking up rapidly; substation transformer and diesel generator capacities beyond 2026H2 are almost fully committed.",
      "source": "Bloomberg Intelligence / SEC Filings"
    },
    {
      "date": "2026-10-30",
      "title": "PJM Interconnection Queue Reform Takes Effect, Yet AIDC Grid Interconnection Queue Time Remains at 38 Months",
      "fact": "PJM Interconnection implemented its 'First-Ready, First-Served' reform. Despite an 18% reduction in backlog, severe shortages of high-voltage substation switchgear maintain the average energization delay at 38.4 months.",
      "impact": "Forces compute clusters toward self-built heavy aeroderivative gas turbines and containerized BESS/diesel hybrids, causing a spike in 2MW+ industrial genset demand.",
      "source": "PJM Official / S&P Global Commodity"
    },
    {
      "date": "2026-10-30",
      "title": "UAE & Saudi Arabia Launch 50GW Sovereign AI Infrastructure Fund, Initial $18B Hardware RFP Mandates Liquid Cooling and Optical Interconnects",
      "fact": "GCC announced a 50GW sovereign AI hub fund. The initial $18B hardware procurement tender mandates cold plate / immersion liquid cooling (PUE <= 1.15) and 800G/1.6T networking, with initial deployment set for Q1 2027. [Vendor Claim]",
      "impact": "High ambient tolerance (50C+ exterior) secondary loops and heavy-duty closed-circuit cooling tower suppliers will see concentrated bidding volume.",
      "source": "Zawya / Arabian Business"
    }
  ],
  "s2_headlines": [
    {
      "id": "evt-20261027-01",
      "title": "Global Substation Transformer Lead Times Breach 120 Weeks, Grain-Oriented Electrical Steel (GOES) Booked Out Through 2028",
      "severity": "HIGH",
      "heat": 95,
      "summary": "According to Wood Mackenzie and NERC, weighted average lead times for 500kV+ step-up and data center pad-mount transformers have stretched to 120-128 weeks (~2.5 years). High-grade Hi-B GOES capacity from Nippon Steel, JFE, and Baosteel has been co-locked by Western grid utilities and hyperscalers through end of 2028.",
      "numbers": [
        "Average Lead Time: 120-128 Weeks",
        "Spot Premium: +45% to +60%",
        "GOES Allocation Locked Through 2028"
      ],
      "event_summary": "The large power transformer deficit has expanded from localized hiccups into a structural bottleneck. Expanding GOES capacity requires 24-36 months, exacerbated by a severe shortage of skilled high-voltage coil winders.",
      "bom_impact_path": [
        "Substation & Power Ingress Subsystem",
        "500kV/220kV Step-Up & Step-Down Transformers",
        "Hi-B Grain-Oriented Electrical Steel (GOES)",
        "HV Insulated Bushings & On-Load Tap Changers"
      ],
      "delivery_forecast": {
        "short_term": "Data center builds lacking pre-booked transformers face 6-12 month commissioning slippages; contractors turning to refurbished units.",
        "mid_term": "Accelerates adoption of 10kV Direct-to-Compute server power architectures and Solid State Transformers (SST)."
      },
      "sources": [
        {
          "outlet": "Wood Mackenzie Power & Renewables",
          "date": "2026-10-25",
          "url": "https://www.woodmac.com/reports/power-transformers-shortage-ai-datacenter/",
          "first_party": false
        },
        {
          "outlet": "NERC Annual Grid Report",
          "date": "2026-10-24",
          "url": "https://www.nerc.com/pa/RAPA/ri/Pages/Default.aspx",
          "first_party": false
        }
      ]
    },
    {
      "id": "evt-20261027-02",
      "title": "Nittobo Low-Dk Quartz Glass Fiber Yarn Allocation Tightens, M8 Copper Clad Laminate Spot Premium Exceeds 30%",
      "severity": "HIGH",
      "heat": 91,
      "summary": "Mass shipments of NVL72 compute and switch trays have triggered a surge in M8/M9 grade CCL consumption. Japan's Nittobo, the primary volume supplier of ultra-low loss (Low-Dk/Low-Df) quartz glass yarn, has allocated over 85% of Q4 output to EMC and Shengyi, pushing secondary PCB maker spot premiums to 31.8%.",
      "numbers": [
        "Nittobo Capacity Locked >85%",
        "Glass Cloth Spot Premium: +31.8%",
        "NVL72 Consumes >150 sqm M8 CCL per Rack"
      ],
      "event_summary": "High-density compute boards feature 32 to 44 layers running 224Gbps PAM4 signals, requiring strict Df <= 0.0015 metrics. Nittobo's new production lines will not achieve full ramp until mid-2027.",
      "bom_impact_path": [
        "Compute Mainboards & High-Speed Switch Backplanes",
        "High-Speed Copper Clad Laminates (CCL)",
        "Low-Dk Quartz Fiber Yarn & Glass Fabric",
        "Specialty Polyphenylene Oxide (PPO) Resin"
      ],
      "delivery_forecast": {
        "short_term": "HLC board makers prioritizing Tier-1 ODMs (Foxconn, Quanta, Wiwynn); secondary ODMs face lead times stretching beyond 40 weeks.",
        "mid_term": "Accelerates qualification of TUC Gen-2 cloth and domestic alternatives from Honghe and Jushi."
      },
      "sources": [
        {
          "outlet": "TrendForce Research",
          "date": "2026-10-26",
          "url": "https://www.trendforce.com/research/low-dk-ccl-shortage-ai-servers-2026",
          "first_party": false
        },
        {
          "outlet": "Nikkei Asian Review",
          "date": "2026-10-25",
          "url": "https://asia.nikkei.com/Business/Electronics/Nittobo-quartz-glass-fiber-ai-supply-chain",
          "first_party": false
        }
      ]
    }
  ],
  "s3_bottlenecks": [
    {
      "category": "供电与基建瓶颈",
      "bottleneck_item": "Large Power Transformers & Gas-Insulated Switchgear (GIS)",
      "analysis": "Gigawatt-scale procurement by hyperscalers is crowding out regional 20-50MW builds, driving secondary transformer refurbishment auctions to double original MSRP.",
      "siphoning_actor": "Microsoft / AWS / Meta Supercluster Dedicated Buildouts",
      "lead_time_weeks": "115-130 Weeks",
      "source": "Wood Mackenzie / Platts"
    },
    {
      "category": "算力机柜与板材瓶颈",
      "bottleneck_item": "Low-Dk / Low-Df Electronic Quartz Glass Cloth & M8 CCL",
      "analysis": "NVL72 intra-rack interconnect density demands 5x the board area of conventional servers; weekly rack deliveries are directly constrained by Nittobo weaving output.",
      "siphoning_actor": "Foxconn / Quanta Dedicated AI Assembly Lines",
      "lead_time_weeks": "40-52 Weeks",
      "source": "Prismark / Digitimes"
    },
    {
      "category": "光铜互连瓶颈",
      "bottleneck_item": "224G Foamed Dielectric Cores for AEC/DAC Cables",
      "analysis": "Micro-cellular physical foaming extrusion yields remain low, and precision silver-plated wire drawing tools face wear limits, leaving Amphenol and Credo backlogged 9+ months.",
      "siphoning_actor": "Blackwell / Rubin Intra-Rack Copper Overpass Cables",
      "lead_time_weeks": "36-48 Weeks",
      "source": "LightCounting / Omdia"
    },
    {
      "category": "液冷温控瓶颈",
      "bottleneck_item": "Heavy-Duty Brazed Plate Heat Exchangers (BPHE) & Canned Pumps",
      "analysis": "Liquid CDU primary heat exchange requires 1.5MPa+ rating and zero-leak reliability; qualified suppliers are concentrated in Danfoss, Alfa Laval, and SWEP.",
      "siphoning_actor": "Vertiv / Boyd / CoolIT Modular CDU Production",
      "lead_time_weeks": "34-46 Weeks",
      "source": "BSRIA / Industry Online"
    }
  ],
  "s4_cross_industry": [
    {
      "upstream_sector": "Electric Utilities & Grid Infrastructure",
      "transmission_logic": "Aging Western grid upgrades and offshore wind interconnections are clashing directly with AIDC buildouts for coil winding machinery and annealing furnace capacity.",
      "impact_magnitude": "Power equipment prices up 22% YTD with 50%+ non-refundable milestone deposits required",
      "source": "FERC / NERC",
      "date": "2026-10-26"
    },
    {
      "upstream_sector": "Commodities & Precious Metals (Copper & Silver)",
      "transmission_logic": "LME spot copper crossed $10,380/t while solar TOPCon paste competes for silver supply with plating on high-speed connectors, inflating BOM costs for silver-plated DAC cables.",
      "impact_magnitude": "DAC/AEC copper cable raw material BOM cost up 14.5% per meter",
      "source": "London Metal Exchange / Silver Institute",
      "date": "2026-10-26"
    },
    {
      "upstream_sector": "Fluorochemical Regulations & PFAS Transition",